company,job_link,job_summary,job_title,location,post_date,salary_range
Ark Pioneer Academy,https://uk.indeed.com/rc/clk?jk=1e96713f9a2747aa&fccid=84ec07cf1b9b3331&vjs=3,"The successful candidate will grow with our school: we will develop you, providing one-to-one support, coaching and access to extensive network training.",Graduate Teaching Assistant,London,30+ days ago,"£23,815 a year"
Proservartner,https://uk.indeed.com/company/Proservartner/jobs/Data-Management-Analyst-86c91bcce1acee04?fccid=468484c1cab68d87&vjs=3,The primary objective for this role will be to focus on,Data Management Analyst,Hybrid remote in Manchester,Active 1 day ago,"£30,000 - £50,000 a year"
proSapient,https://uk.indeed.com/company/proSapient/jobs/Graduate-Language-Associate-30d665ff65746f9f?fccid=9d0968b95338e278&vjs=3,"You have an interest or background in research, economics, business or financial markets.",Graduate Language Associate (European Languages) - 2022 Star...,Hybrid remote in London,30+ days ago,"From £31,000 a year"
AKT II,https://uk.indeed.com/rc/clk?jk=968be96f9b2968ba&fccid=fe2d21eef233e94a&vjs=3,"To be considered for this role, you must be fluent in English and Slovak, and a recent",Graduate Recruiter - Slovak Speaking,London,23 days ago,"£24,000 - £28,000 a year"
The Grange Academy,https://uk.indeed.com/rc/clk?jk=f947e1a20d7864a0&fccid=bcaf39653f44d846&vjs=3,Define,Data Management Specialist,Hybrid remote in Southampton,1 day ago,"£45,951 - £51,357 a year"
Ark Pioneer Academy,https://uk.indeed.com/rc/clk?jk=1e96713f9a2747aa&fccid=84ec07cf1b9b3331&vjs=3,"The successful candidate will grow with our school: we will develop you, providing one-to-one support, coaching and access to extensive network training.",Graduate Teaching Assistant,London,30+ days ago,"£23,815 a year"
Pattern,https://uk.indeed.com/rc/clk?jk=164e94370a64ad28&fccid=198b7374e1f8a26f&vjs=3,"You’ll often need to explain complex financial information, so you’ll need excellent written and verbal communication skills.",Audit Assistant Graduate (ACA) - London August 2022,London,21 days ago,"£25,000 - £30,000 a year"
Emtec Ltd,https://uk.indeed.com/rc/clk?jk=966b558c10f7db45&fccid=2b7983d6b65c6b71&vjs=3,Have responsibility for,Data Officer,Remote in Stockport SK1,3 days ago,"£27,000 a year"
AKT II,https://uk.indeed.com/rc/clk?jk=968be96f9b2968ba&fccid=fe2d21eef233e94a&vjs=3,"To be considered for this role, you must be fluent in English and Slovak, and a recent",Graduate Recruiter - Slovak Speaking,London,23 days ago,"£24,000 - £28,000 a year"
Davanti Solutions,https://uk.indeed.com/company/Davanti-Solutions/jobs/Graduate-Marketing-Assistant-8d26a7de374c1b51?fccid=c57d6bd1cacc7187&vjs=3,\*Organise exhibitions/conferences/events including digital marketing.,Graduate Marketing Assistant,Welwyn Garden City,4 days ago,"£27,000 - £30,000 a year"
Intent HQ,https://uk.indeed.com/rc/clk?jk=c65b3b2b77368184&fccid=4cc7e25ce5dad2df&vjs=3,Support,Master Data Manager,Milton Keynes,1 day ago,"£47,380 a year"
Pattern,https://uk.indeed.com/rc/clk?jk=164e94370a64ad28&fccid=198b7374e1f8a26f&vjs=3,"Our team carries out a detailed, risk-based review of a company’s financial records and control environment to form an opinion on whether the financial…",Audit Assistant Graduate (ACA) - London August 2022,London,21 days ago,"£25,000 - £30,000 a year"
27 Talent,https://uk.indeed.com/company/27-Talent/jobs/Graduate-Recruitment-Consultant-Marketing-Sales-3f7133b74fa08eaf?fccid=36e76ed16e2d480f&vjs=3,Every,Graduate Recruitment Consultant – Marketing & Sales (£40k),London WC1R,Active 2 days ago,"£26,000 - £40,000 a year"
Talenting,https://uk.indeed.com/rc/clk?jk=05c59df6f6916547&fccid=73da13d58dc1080c&vjs=3,We work in cross-functional squads where every,"Data Science Manager, Operations",Remote in London,3 days ago,"£35,000 - £50,000 a year"
Davanti Solutions,https://uk.indeed.com/company/Davanti-Solutions/jobs/Graduate-Marketing-Assistant-8d26a7de374c1b51?fccid=c57d6bd1cacc7187&vjs=3,\*Organise exhibitions/conferences/events including digital marketing.,Graduate Marketing Assistant,Welwyn Garden City,4 days ago,"£27,000 - £30,000 a year"
Elkington and Fife,https://uk.indeed.com/rc/clk?jk=5115584468722c76&fccid=46d42ce295ddcb07&vjs=3,Have at least a 2:1 Degree in any subject.,Trainee Patent Attorneys,London,30+ days ago,"From £28,500 a year"
Keystone Property Finance,https://uk.indeed.com/rc/clk?jk=060ae707436e1f9c&fccid=c36c977883c7b1e5&vjs=3,"The Workforce Planning and Intelligence (WPI&I) team exists to enable, promote, and support the effective use of",Data Officer,Sheffield S4,1 day ago,"£25,655 a year"
27 Talent,https://uk.indeed.com/company/27-Talent/jobs/Graduate-Recruitment-Consultant-Marketing-Sales-3f7133b74fa08eaf?fccid=36e76ed16e2d480f&vjs=3,Every,Graduate Recruitment Consultant – Marketing & Sales (£40k),London WC1R,Active 2 days ago,"£26,000 - £40,000 a year"
2Fawcett Recruitment,https://uk.indeed.com/rc/clk?jk=5a40a5c9b987f38e&fccid=bafa4b35e9cd20ce&vjs=3,We will push you to achieve the highest standards and expect our,Graduate Project Manager ( Healthcare Projects),Hybrid remote in London,30 days ago,"£20,000 - £24,000 a year"
Bray Leino,https://uk.indeed.com/company/BRAY-LEINO/jobs/Digital-Data-Analyst-b635fe24c137bd1a?fccid=a2c10f2e0bb0f966&vjs=3,Experience of working as part of a,Digital Data Analyst,Remote in Devon,30+ days ago,"£25,000 - £35,000 a year"
Elkington and Fife,https://uk.indeed.com/rc/clk?jk=5115584468722c76&fccid=46d42ce295ddcb07&vjs=3,Have at least a 2:1 Degree in any subject.,Trainee Patent Attorneys,London,30+ days ago,"From £28,500 a year"
Parker Smith Inclusion,https://uk.indeed.com/company/Parker-Smith-Inclusion/jobs/Psychology-Graduate-8107b303c19e5d8a?fccid=6003e06c38a079e7&vjs=3,"Monday to Friday, 9am – 4pm (32.5 working hours per week).",Psychology Graduate,Peckham,2 days ago,£75 - £88 a day
Boston Hale,https://uk.indeed.com/rc/clk?jk=4d28107f91f6181c&fccid=b968b58ad5fb8d16&vjs=3,Update databases and,Portfolio Data Analyst,London,10 days ago,"Up to £60,000 a year"
Improbable,https://uk.indeed.com/company/IQVIA/jobs/Sales-Representative-44b9f124bfca349f?fccid=6b7a1dfe07e7f037&vjs=3,"Online wellbeing support available 24 hours a day, 7 days a week, 365 days a year.",Sales Representative (Graduate),London,Active 2 days ago,"£12,000 a year"
Kseye Group Ltd,https://uk.indeed.com/rc/clk?jk=8b99d11e764bb016&fccid=1976b8742794eede&vjs=3,"This office of circa 25 people needs a switched on, high energy all-rounder to help them with all manner of things – office management, admin, meeting and…",Office Assistant,London,6 days ago,"£27,000 a year"
EDITED,https://uk.indeed.com/company/EDITED/jobs/Data-Scientist-2db645c66500c1b4?fccid=8c2d103364827a9a&vjs=3,,Data Scientist,London,30+ days ago,"£116,272 - £145,340 a year"
Parker Smith Inclusion,https://uk.indeed.com/company/Parker-Smith-Inclusion/jobs/Psychology-Graduate-8107b303c19e5d8a?fccid=6003e06c38a079e7&vjs=3,"Monday to Friday, 9am – 4pm (32.5 working hours per week).",Psychology Graduate,Peckham,2 days ago,£75 - £88 a day
Clean Cold Power UK Ltd,https://uk.indeed.com/rc/clk?jk=6c93eb48e9f8cc9f&fccid=f1582c464db8553b&vjs=3,"You will join our existing cohort of Engineers, Scientists, Project Managers, Data specialist, Environmentalist, Talent Acquisition & HR, Health Safety and…",Graduate Civil Engineer 2022 (London),London,30+ days ago,"£30,000 - £34,000 a year"
Wowcher,https://uk.indeed.com/rc/clk?jk=962c3f99b34234c9&fccid=7691ebb71b24124c&vjs=3,The post holder will have a general awareness of current,Data Protection Analyst,Bothwell G71,10 days ago,"£26,104 - £32,915 a year"
Kseye Group Ltd,https://uk.indeed.com/rc/clk?jk=8b99d11e764bb016&fccid=1976b8742794eede&vjs=3,"This office of circa 25 people needs a switched on, high energy all-rounder to help them with all manner of things – office management, admin, meeting and…",Office Assistant,London,6 days ago,"£27,000 a year"
Superscript,https://uk.indeed.com/rc/clk?jk=faf4c5c9c283d27a&fccid=638bbc7ea7f27233&vjs=3,"Salary: Salary starting at Grade 6 (£16.81 per hour, inclusive of London Allowance) Contact hours are paid at a multiplier of 2.5 basic hours, with annual leave…",Graduate Teaching Assistant – School of Arts,Camden,7 days ago,£16.81 an hour
kdr Recruitment,https://uk.indeed.com/rc/clk?jk=d6cffaffd7906d4a&fccid=66510c97e3970bde&vjs=3,"Using their own AI-Driven Customer Intelligence Platform, they help their clients build stronger customer experiences and relationships.","Junior Data Scientist | London | £55,000",Hybrid remote in London,20 days ago,"£40,000 - £55,000 a year"
Clean Cold Power UK Ltd,https://uk.indeed.com/rc/clk?jk=6c93eb48e9f8cc9f&fccid=f1582c464db8553b&vjs=3,"You will join our existing cohort of Engineers, Scientists, Project Managers, Data specialist, Environmentalist, Talent Acquisition & HR, Health Safety and…",Graduate Civil Engineer 2022 (London),London,30+ days ago,"£30,000 - £34,000 a year"
Placido Group,https://uk.indeed.com/company/BL-Recruitment/jobs/PR-Graduate-8670847456354e10?fccid=79027a9bc6436e4c&vjs=3,We are recruiting for a PR agency based in London working within the technology sector.,PR Graduate,London,Active 3 days ago,"£24,000 a year"
Superscript,https://uk.indeed.com/rc/clk?jk=faf4c5c9c283d27a&fccid=638bbc7ea7f27233&vjs=3,"Salary: Salary starting at Grade 6 (£16.81 per hour, inclusive of London Allowance) Contact hours are paid at a multiplier of 2.5 basic hours, with annual leave…",Graduate Teaching Assistant – School of Arts,Camden,7 days ago,£16.81 an hour
FXC Intelligence,https://uk.indeed.com/rc/clk?jk=1a3c513e3c9176e6&fccid=057abf3fd357e717&vjs=3,"A bank that knows its customers and clients, champions innovation and thinks digital first, offers trusted money management guidance and support, and provides…",Payments & Platforms Data & Analytics Analyst - Expert Gradu...,London E14,30+ days ago,"£26,447 - £28,780 a year"
Vested,https://uk.indeed.com/rc/clk?jk=4d3e63c1e2e2e167&fccid=25fcc0ef2edd3f05&vjs=3,Want to make your mark in Research and Development?,Pharmacy Graduate Scheme,Slough SL1,30+ days ago,"£25,001 - £35,000 a year"
Placido Group,https://uk.indeed.com/company/BL-Recruitment/jobs/PR-Graduate-8670847456354e10?fccid=79027a9bc6436e4c&vjs=3,We are recruiting for a PR agency based in London working within the technology sector.,PR Graduate,London,Active 3 days ago,"£24,000 a year"
Lucky Innotech Solutions Limited,https://uk.indeed.com/rc/clk?jk=28f0feba0c255b8d&fccid=ee0e27da47075aef&vjs=3,Helping to develop and update,Junior Data Scientist,Hove,30+ days ago,"£28,756 - £34,304 a year"
Celsius Graduate Recruitment,https://uk.indeed.com/rc/clk?jk=e03c561ad3bb023b&fccid=b5859a562bd5d66f&vjs=3,"Graduate Forex Business Development Executive £25K to £27K Base, OTE Year 1 £60k, Year 2 £150k Year 3 upwards of £200k Excellent Benefits including amazing…",Graduate FOREX Business Development Executive,London,30+ days ago,"£150,000 a year"
Vested,https://uk.indeed.com/rc/clk?jk=4d3e63c1e2e2e167&fccid=25fcc0ef2edd3f05&vjs=3,"With complete involvement from the first day, on our scheme you’ll be fully included as part of our team bringing household name products to millions of…",Pharmacy Graduate Scheme,Slough SL1,30+ days ago,"£25,001 - £35,000 a year"
ISL,https://uk.indeed.com/company/learndirect/jobs/Group-Financial-Planning-Analysis-Data-Analyst-9df6ee6cde8406a1?fccid=3b5aa9fa955be7f1&vjs=3,Experience in handling and analysing large volumes of,Group Financial Planning and Analysis & Data Analyst,Bournemouth BH1,Active 2 days ago,"£35,000 - £50,000 a year"
IN2 Design Partnership Ltd,https://uk.indeed.com/company/Arriva/jobs/Graduate-Transport-Operation-Manager-55a5a52312485e96?fccid=a022eb6826538a93&vjs=3,Quarterly reviews with a dedicated Arriva Team Member to ensure your,Graduate Transport Operations Manager - Regional,Finsbury Park,Active 15 days ago,"From £25,000 a year"
MMGY Global LLC,https://uk.indeed.com/rc/clk?jk=86be5f4f676abf00&fccid=4a9bb59ede5bc447&vjs=3,We are looking for a,UK - PR Account Executive,London SE1,30+ days ago,"£25,000 - £35,000 a year"
BU-UK Infrastructure,https://uk.indeed.com/company/Power-on-Connections/jobs/Data-Analyst-91912781fc0f4db9?fccid=0aca8f6d4e8ba424&vjs=3,"Develop dashboard style management reporting, enabling stakeholders to view",Data Analyst,Temporarily Remote in Woolpit,Active 4 days ago,"From £27,319 a year"
Together Creative,https://uk.indeed.com/company/Together-Creative/jobs/Studio-Operation-Assistant-6728f1a8165ab84d?fccid=67a26c8f99df3404&vjs=3,This role is full time in the office.,Studio Operations Assistant,London SW4,Active 2 days ago,"£20,000 - £22,000 a year"
IN2 Design Partnership Ltd,https://uk.indeed.com/rc/clk?jk=3e221c337caca084&fccid=57438535c8d8d07a&vjs=3,A 5 week technical training course worth £12k but at no cost to you and delivered remotely.,PMO Graduate Scheme,London,22 days ago,"£27,000 a year"
"Macquarie Energy, Resources and Sustainability",https://uk.indeed.com/rc/clk?jk=30cfb8ee9c603f49&fccid=8b9fb66bfe630048&vjs=3,Confident in giving presentations and explaining,Data Scientist,Hybrid remote in Preston PR2,30+ days ago,"£21,000 - £23,000 a year"
Merit Tutors/Exam Centre London,https://uk.indeed.com/company/Merit-Tutors/jobs/Online-Spanish-Tutor-9efe21678bbde046?fccid=f4cd7e2edc178803&vjs=3,For current,Online Spanish Tutor,Remote in London,Active 11 days ago,"£12,000 a year"
Together Creative,https://uk.indeed.com/rc/clk?jk=ada799d7fa2399ac&fccid=d665162c38ac81bc&vjs=3,,Graduate Trainee in Research Communications,Remote in Twickenham,13 days ago,"£20,000 - £22,000 a year"
Applied Market Information Ltd,https://uk.indeed.com/company/Applied-Market-Information-Ltd/jobs/Data-Research-Administrator-c9aa9d6d71a4cd20?fccid=2d8f7524c0b76f4d&vjs=3,Work on briefs to build,Data Research Administrator,Bristol BS2,1 day ago,"£18,500 a year"
Merit Tutors/Exam Centre London,https://uk.indeed.com/company/Merit-Tutors/jobs/Online-Spanish-Tutor-9efe21678bbde046?fccid=f4cd7e2edc178803&vjs=3,For current,Online Spanish Tutor,Remote in London,Active 11 days ago,"£12,000 a year"
Zync. Group,https://uk.indeed.com/rc/clk?jk=aecb66299c1c1385&fccid=1d6acce86770faa4&vjs=3,"1-3 years of Business Analysis experience, ideally in a similar data-related role.",Business Analyst - Data,Leeds,30+ days ago,"£18,000 - £22,000 a year"
SaltPay,https://uk.indeed.com/rc/clk?jk=0cc3f11d4b548c65&fccid=38c0d5e4f2a99768&vjs=3,We're looking for,Graduate Blast Engineer,London,3 days ago,"£25,000 a year"
TVS Supply Chain Solutions,https://uk.indeed.com/rc/clk?jk=3b134cc9a0ee28dd&fccid=374d720d3973ca1c&vjs=3,Strong experience in establishing and running,Data Governance Manager,London,6 days ago,"£13,055 - £17,032 a year"
Quinnox Consultancy Services,https://uk.indeed.com/company/Quinnox-Consultancy-Services-Limited/jobs/IT-Fresher-6cdac20e4c062557?fccid=1474eff2fe926b1d&vjs=3,Computer Science Degree or equivalent.,IT Fresher - Software Trainee,London,Active 2 days ago,"£23,000 - £25,000 a year"
SaltPay,https://uk.indeed.com/rc/clk?jk=0cc3f11d4b548c65&fccid=38c0d5e4f2a99768&vjs=3,We're looking for,Graduate Blast Engineer,London,3 days ago,"£25,000 a year"
Datatecnics Corporation,https://uk.indeed.com/rc/clk?jk=38cdf6682a5c8c74&fccid=431c8986bde76285&vjs=3,Delivers domain,KEU Data Governance Analyst,Salford M50,1 day ago,"£55,000 - £65,000 a year"
Wesley Gryk Solicitors LLP,https://uk.indeed.com/company/Wesley-Gryk-Solicitors-LLP/jobs/Paralegal-67574b8d8613c376?fccid=2d4f59e5b78e5684&vjs=3,"The successful candidate will have excellent communication skills, attention to detail, and the ability to effectively prioritise and manage deadlines.",Paralegal,London SE1,Active 2 days ago,"£23,257 - £26,350 a year"
Quinnox Consultancy Services,https://uk.indeed.com/company/Quinnox-Consultancy-Services-Limited/jobs/IT-Fresher-6cdac20e4c062557?fccid=1474eff2fe926b1d&vjs=3,Computer Science Degree or equivalent.,IT Fresher - Software Trainee,London,Active 2 days ago,"£23,000 - £25,000 a year"
Kaleidoscope Consultants Ltd,https://uk.indeed.com/company/Kaleidoscope-Consultants-Ltd/jobs/Experienced-Consultant-43237c663f59f523?fccid=b9c522ccbbdacd22&vjs=3,Establishing linked research,Experienced Consultant: expert in data protection in health,Temporarily Remote in London,Today,"£40,000 - £70,000 a year"
Zodiac Recruitment,https://uk.indeed.com/rc/clk?jk=5182a85312b960d3&fccid=fcce311099a3a228&vjs=3,We are currently recruiting for a September 2022 start date in our London and Glasgow offices.,Tax Graduate Programme,London,30+ days ago,"£22,000 - £24,000 a year"
Wesley Gryk Solicitors LLP,https://uk.indeed.com/company/Wesley-Gryk-Solicitors-LLP/jobs/Paralegal-67574b8d8613c376?fccid=2d4f59e5b78e5684&vjs=3,"The successful candidate will have excellent communication skills, attention to detail, and the ability to effectively prioritise and manage deadlines.",Paralegal,London SE1,Active 2 days ago,"£23,257 - £26,350 a year"
Matillion,https://uk.indeed.com/rc/clk?jk=82f9b65d258a82e5&fccid=97566ba3c4d8abca&vjs=3,Identify potential new,Lead Data Scientist,London,30 days ago,"£64,000 a year"
Inside Out Purchasing & Supply,https://uk.indeed.com/rc/clk?jk=7d9f3c2cbc07f44b&fccid=9fc0bcd5c6db2f12&vjs=3,This role would ideally suit a recent,Graduate Buyer,London,3 days ago,"Up to £26,000 a year"
MPL Search,https://uk.indeed.com/company/MPL-Search/jobs/Graduate-Recruitment-Consultant-Scheme-6735d274d49e4447?fccid=508141732116db6a&vjs=3,"With a base salary of £28,000 and OTE in the first year of between £45,000 - £50,000, as a",Graduate Recruitment Consultant Scheme,London,Hiring ongoing,"£28,000 - £50,000 a year"
Albert Kennedy Trust,https://uk.indeed.com/rc/clk?jk=344bdee79e9496ee&fccid=89a1a7b0050ae6e6&vjs=3,Working with,Head of Student Data and Returns,South Kensington,30+ days ago,"£49,482 - £59,582 a year"
Mediaplanet,https://uk.indeed.com/rc/clk?jk=cbac1b995d6c4b04&fccid=fd8cda73a7fe0af3&vjs=3,Flexible work from home/office work split.,Junior Research Executive,Remote in London SW1Y,7 days ago,"£25,000 - £30,000 a year"
Inside Out Purchasing & Supply,https://uk.indeed.com/rc/clk?jk=7d9f3c2cbc07f44b&fccid=9fc0bcd5c6db2f12&vjs=3,This role would ideally suit a recent,Graduate Buyer,London,3 days ago,"Up to £26,000 a year"
Graduate Programme Wales,https://uk.indeed.com/company/Fire-Glass-UK/jobs/Data-Analyst-4cff24298f680335?fccid=c1c6c060ddf27cfb&vjs=3,Analyse and interpret multiple,Data Analyst,Oldbury,Active 3 days ago,"£20,500 a year"
Curation Corporation Limited,https://uk.indeed.com/company/Curation-Corporation-Limited/jobs/Energy-Specialist-b6627e489dc3bb4b?fccid=35fbb7c4ab7e34e4&vjs=3,We are also open to applications from recent,Energy Specialist,Hybrid remote in London EC2A,30+ days ago,"£25,000 - £30,000 a year"
Mediaplanet,https://uk.indeed.com/rc/clk?jk=cbac1b995d6c4b04&fccid=fd8cda73a7fe0af3&vjs=3,Flexible work from home/office work split.,Junior Research Executive,Remote in London SW1Y,7 days ago,"£25,000 - £30,000 a year"
Quacquarelli Symonds,https://uk.indeed.com/rc/clk?jk=1a3bf100d0eb679d&fccid=d621f9a5603cfedd&vjs=3,,Data & Test Analyst,Esher,3 days ago,"£116,272 - £145,340 a year"
RWC,https://uk.indeed.com/rc/clk?jk=a6af851e696e091c&fccid=d72eb0548d91249c&vjs=3,22k Base salary plus commission (35-40 OTE).,Graduate Recruitment Consultant - June/July Start Dates,London,2 days ago,"£22,000 - £40,000 a year"
Curation Corporation Limited,https://uk.indeed.com/company/Curation-Corporation-Limited/jobs/Energy-Specialist-b6627e489dc3bb4b?fccid=35fbb7c4ab7e34e4&vjs=3,We are also open to applications from recent,Energy Specialist,Hybrid remote in London EC2A,30+ days ago,"£25,000 - £30,000 a year"
Keylime Consultants,https://uk.indeed.com/rc/clk?jk=10fa3f787fb484d0&fccid=130f6ee263a47ae6&vjs=3,As a Workday,Workday Data & Reporting Senior Analyst,London,1 day ago,"Up to £80,000 a year"
Progressis,https://uk.indeed.com/rc/clk?jk=5bf2ac57e804db91&fccid=1976b8742794eede&vjs=3,""" Minimum of 1-2 years of experience in a similar role or a Marketing",Marketing Assistant,London,6 days ago,"£25,000 - £28,000 a year"
Hayden Nash Consultants Ltd,https://uk.indeed.com/pagead/clk?mo=r&ad=-6NYlbfkN0BQG1AC3h_ac1S-gGeMhfcRnCXpJr-fyCpErna8fzHOKzNRlx0njIb8slriQekexVZ8ItmJJXpPlQNMUFqBGDaXhIQbOUETo9OgacELH0vujbBkKqvm0ciMA4xIT4oK0FLXGFaw7obfczisIfv-7VjZksGHQd6v-ts2sFPPrHFxhLQGn67kcUH2L-OQOhhRWgPxKtLYzWxBZ305ITGEzQh7rZoiN6mQ6pkYuIN5gadABFoS1D-ubH3lZUkWkfaQgT7JjbDWW9pMQv0PM42GnSVFprac7l9UxlivhnxNETad2sUStofOcsM7oWbiHLXDlp6B7d8vIfehYhgentetaqYZT9CNXPMVM4QDsaVmUA9mDII33K7Wtf1qVqn4088hU2Ms80qy4iPcu7SiMQ6f1q8_vGh3FBxwa0y-Iw15kenOfgM3NrqFpkoQpEjedsZCd4OJzXyNHDL5UgbYAzTPXFWTp-r8SVKsobv5Obk-s5Jw7xj9KdsUslALGHP3J50a3jx3f4qNDjjgok8R6Ct-7lSPjV43kfw-EnVFyOBi1b5wlYOBLnXN9Ldx8U8BDDvTQ6Ub0OSd7BzYLNXD3BqW1NoJQM4JlBwRiPE=&xkcb=SoDe-_M3cdKtEsw8BR0LbzkdCdPP&p=0&fvj=1&vjs=3,"Hours: 21 hours per week – Mondays required, other days to be confirmed (additional hours may be possible)*.",Library Graduate Trainee - RHS London,London,1 day ago,"£12,000 a year"
Uniting People,https://uk.indeed.com/rc/clk?jk=a1205e72967f59f1&fccid=b81282b879961548&vjs=3,Review and authorise any system changes that may affect,Records and Data Manager,Bracknell,15 days ago,£600 - £625 a day
Costello Medical,https://uk.indeed.com/company/Costello-Medical-Consulting-Limited/jobs/Graphic-Design-Internship-47cafbf852751e60?fccid=787c670843a5aa79&vjs=3,This position is ideal for Graphic Design students or recent,Graphic Design Internship,Remote in London,30+ days ago,"£21,800 a year"
Progressis,https://uk.indeed.com/rc/clk?jk=5bf2ac57e804db91&fccid=1976b8742794eede&vjs=3,""" Minimum of 1-2 years of experience in a similar role or a Marketing",Marketing Assistant,London,6 days ago,"£25,000 - £28,000 a year"
Denfield,https://uk.indeed.com/company/Denfield/jobs/Data-Marketing-Analyst-728978e91fb1b730?fccid=a46837a6530d625a&vjs=3,Use,Data Marketing Analyst,Leamington Spa CV32,Active 4 days ago,"£26,000 - £30,000 a year"
ECM Selection,https://uk.indeed.com/rc/clk?jk=c68aa214bdd8d881&fccid=d8589ac02ce8d5f2&vjs=3,"To thrive in this role, you will need an exceptional educational background with a minimum of a 2.1 degree from a leading university in Electronics or a closely…",Graduate Electronics Engineer,West London,30+ days ago,"£40,000 a year"
Costello Medical,https://uk.indeed.com/company/Costello-Medical-Consulting-Limited/jobs/Graphic-Design-Internship-47cafbf852751e60?fccid=787c670843a5aa79&vjs=3,,Graphic Design Internship,Remote in London,30+ days ago,"£21,800 a year"
Aubay UK,https://uk.indeed.com/rc/clk?jk=ac756823691281d9&fccid=2ab0f7ec57cbbbfc&vjs=3,"Solid understanding of computer science fundamentals, including",Data Scientist,Hybrid remote in London W2,30+ days ago,"£45,900 - £57,300 a year"
HDR,https://uk.indeed.com/rc/clk?jk=d83fd1fc96ebf47c&fccid=c3725c584175877c&vjs=3,Assist senior engineers and the winder team in the design process in order to gain a detailed working knowledge of all parts of the industry.,Electrical Graduate Engineer,London,30+ days ago,"£28,840 a year"
Trace Recruit Ltd,https://uk.indeed.com/company/THORP-PRECAST-LIMITED/jobs/Graduate-Assistant-Construction-Site-Manager-fc5aa01368ff53de?fccid=5eec1d53b1cce6bc&vjs=3,Remuneration: * Competitive rates of pay available subject to candidates experience and skill set.,Graduate Assistant Construction Site Manager,London,Active 2 days ago,"£26,000 - £28,000 a year"
The Intrapreneurs Club,https://uk.indeed.com/company/The-Intrapreneurs-Club/jobs/Data-Engineer-fd8d8ce9225c2152?fccid=c458747b6e8038a2&vjs=3,Be part of a,Data Engineer,Northampton,1 day ago,"£85,000 a year"
J Browne Construction Co Ltd,https://uk.indeed.com/company/J-Browne-Construction-Co-Ltd/jobs/Graduate-Platform-Developer-226dbd53f12db506?fccid=8ae5dc29bb521b6f&vjs=3,"You will be in a business-critical role, responsible for developing and maintaining digital products, and rolling them out to users.",Graduate Platform Developer,Hybrid remote in Enfield,Active 3 days ago,"Up to £33,000 a year"
HDR,https://uk.indeed.com/rc/clk?jk=d83fd1fc96ebf47c&fccid=c3725c584175877c&vjs=3,Assist senior engineers and the winder team in the design process in order to gain a detailed working knowledge of all parts of the industry.,Electrical Graduate Engineer,London,30+ days ago,"£28,840 a year"
Ambition Recruitment,https://uk.indeed.com/rc/clk?jk=8360cf5f369d7412&fccid=40bdb3ff12c06472&vjs=3,Ability to manage large quantities of,Content Data Coordinator,Hybrid remote in London W12,8 days ago,"£34,404 - £42,057 a year"
Houst,https://uk.indeed.com/company/Houst-Ltd/jobs/Graduate-1012b62301a0bd11?fccid=90032c5873ea975f&vjs=3,The Account Manager's primary function is to optimise host revenue through proactive and effective management of property portfolio.,Graduate - Account Manager,London,9 days ago,"£22,000 - £24,000 a year"
chapmanbdsp,https://uk.indeed.com/rc/clk?jk=f12a391b0cb1dc95&fccid=dd8eeced66ff43fc&vjs=3,Assisting with the preparation of outline design schemes.,Graduate Electrical Engineer,London,6 days ago,"£22,000 - £24,000 a year"
Projecting Success,https://uk.indeed.com/rc/clk?jk=f6481c4d744e00cb&fccid=069a96b26806555a&vjs=3,A record of outstanding contribution to,Data Scientist (Game / Concept Testing),Remote in Leamington Spa,29 days ago,"£23,211 - £25,790 a year"
Antonia Saunders Recruitment,https://uk.indeed.com/company/Antonia-Saunders-Recruitment/jobs/Part-Time-Legal-Finance-Assistant-cd0ebe2d32a24416?fccid=28a8fb213e71623e&vjs=3,"Working Mondays, Tuesdays and Thursdays 9-4 (21 hours/week) on a project lasting 6-12 months.","Part-time Legal/Finance Assistant, recent Graduate, 6-12 mon...",West London,10 days ago,£20 an hour
