company,job_link,job_summary,job_title,location,post_date,salary_range
TmC Planning and Property Development Ltd.,https://uk.indeed.com/pagead/clk?mo=r&ad=-6NYlbfkN0CMJu662KWcDGFOv7L3mtQo3gdqSzkBml2Qc7GuPNqg67wjLpNs36cST7WmMoB_rFAsE4TQtKTsK0IzE5IVHWNmLurDzEXUIz9b-FLzxx_8yFHMWzMBUh-gOMgYLMoZIY-qa_xy7iWDMO-PBECOr23WeAoNwpFqSGMA5Z0Vag_cLQK6lxxBmpN_dVnZdVzWBNauOtj5_CwXng2ngoSZp1xrP12_HrOsTSTIiMNBPy1Mbq6qntOknpknkgxFRILTYf2fI20yO0YkRZHC8Ra02uiq_Q33JuA5GD_iSFvejX8WSIHwlH9VSCUgsSA736fzE7UXzD5M9Wm8WnTmA6L6KhUFK9OtrZctXTb4k9aG0iityqQdwuD18Dzrd2Bt0L86_Ti85qvCXEUdNRHj9OxygSQ6L5b1GPs4qHMDQAzG6of6-LwBP-wbcwQI_r6qnsLFIttCqOW8-Xgo4r-ZKurHDdD8bSA9NWT-qKxyn0w7rjq8UQ==&xkcb=SoDc-_M3cdKZU7xSQp0LbzkdCdPP&p=0&fvj=1&vjs=3,"You will be part of a team of planners., and will aid with research, planning statements etc.",Graduate Town Planning Consultant,Livingston,3 days ago,"£20,500 - £23,000 a year"
Artesia Consulting Limited,https://uk.indeed.com/rc/clk?jk=3606aec40f3781ee&fccid=983a0320ebe2937a&vjs=3,"Working in cross-company multi-disciplinary teams comprising customer insight, product managers, architects, developers, testers, and",Junior Data Engineer,Remote in Gloucestershire,Today,"Up to £26,040 a year"
Mojo,https://uk.indeed.com/pagead/clk?mo=r&ad=-6NYlbfkN0BBzpTrUEEbl2eT-1NJf7U4BOvM9TidAaIbzc_6DMC19GdPEQqU5LaGhNb1EqPBycD7l3x4iSTQ3IQZ1_w84yOQeSsv28-MILrbj9d_auRX578sVlQkXBoxtXV2SE3etLXp1DQzGml-gvv1l3XzHq4LUmg_G0dvrJ1CoQLRImTDCpUvR1fDjRuoRuCzUipacgTD2a5qzWwIgA0BUMlMt9QsyGr4Chh7uudP6NM6B_3_1G7nM4iJmUF6hVuqzkjrWRFxwsop3t5gMFNa-vA_n6UC_O9MiCjHvUc6xzqCkRkthdZmPvj88SNK9utS90f9fCKjTnxD4LMSzU6B6IgfHjX81eJnomT7h6ZFizEs_EF8RC50zf4GTmQeoAKbvQDOBZ0-FLEFwOa2xC9MnIUT8vxsvy_1w-OEwx6c7FVhGO9tJsBgvcReVNAD7xKqOzNhQKG9TsticEs8IaJc2y8niJti&xkcb=SoAt-_M3cdKZTPQd0Z0LbzkdCdPP&p=0&fvj=1&vjs=3,We are looking for,Business Development Executive (Graduate),Manchester,3 days ago,"£23,000 a year"
My Recruitment Career,https://uk.indeed.com/pagead/clk?mo=r&ad=-6NYlbfkN0A9qh1fxxjiQ2Y8cop2XYomuTWKhSITsRvev9V7GEhpkqaHfrDpgQLpFb-yhez3J8JuT3_J_4ob4b6qvPxIUkH4JVf9LYMQckZqQCU7pb8YV_z8gw7tOxq8p6lh9tD33dGPFgPoCfzFHcNJIvMNQCK5egLeSYenqmusJU0tl54iyJohfaF322-dRj8meoN0I2zUMjcqUGf8vUgOzp-V70F2pkzD_6vLYFRMUgLwLJEZjGNw9SIPf-ylaz59mu4GdYdk7VIjmnsCe8AUjmF9u3ni0dsLgTpmwn8h9vNGKlPWhAkpwllkeqglS0qTQw6Np-WrXxuNNkf1SP8dL9v5DRXLhmkYLZ7M6JZgR3iDb6Clbv8KUKVPd2XSVVojaU22hR1yPeGXjbij-WjYOSnSHVj3B3CYipFM7euaT3HSVXHN8ARF9vOBC7ij5-JSR0fH4QLcJyJmzUfgtjdBIrcpXfG_ikwoBhr1maDwD8PElygVLxAvtZyRs2Fp_nkLtBJsxsmbHth2T0Rk4MYomOndbk2kWRnJXeHyvPeoF8FFgIVVha-wA8agUaudpbFpUDBWbxZfZLF-4BbmgnaztAZGeJECMtWAiwBcV8uJB9EXnhloMQBuKzfP907uCqD0u5vr4Blnuw1iBqjzFr1Q1GlvVDfBrW6fDw3CInd0-lP_t3V7RgnIhcMl4W7Xb5wVUznJ1nLAmmHiCFjD3Rp5HI79G84xxjkAQ3OeUQfz4VT1QtOjQFECLxJa7mZo&xkcb=SoDY-_M3cdKZf3gNfj0LbzkdCdPP&p=0&fvj=0&vjs=3,"Within financial services our clients cover industries within banking and capital markets, private equity, insurance, and consumer finance.","Graduate Audit, Leeds",Leeds,30+ days ago,"£22,000 - £60,000 a year"
Heliguy,https://uk.indeed.com/pagead/clk?mo=r&ad=-6NYlbfkN0ADeQntpmtUMXxyoh-Qt_3imdmypB23asUa0gM9HHSZqK7NsF13p6diWG1wBG0TcGaJb-ieTv_CHwy5y3NTo-oVR72pTSqnazLuTEORLLP38f12R-HrZAcWt9TVMsij6A3R6Y0zsEvfcQYuwav7fo4hcLsh3f854Tz4iFlkQ_wE0emDowJkI9I6q4cHosmexq8ul8TV6GCTmm6BoAzHMoRpzFXjNmnTFo9c1VNYwQBP15NeZ0UovvcTRlgMlDJPpZPCBeNfVUkn3wLdOreQIJofhBOTTfN6ji2wUhK1rbYNiQ_oVlAIP-KgcxydnTbovVOjhdgB5NMW9BrLLQXOIpNri7zQ58D69q7XS3ltSkrK0aEWgLBGIgC63xHOnhY4oswPhuxMJ8aFC_r-iSol5ZJ281BqzYdeCNx1ereQ5imzeG9R-m0N-YidFOLeZPDp5MUa6Cfs0qgR5brx1gEI_ukQEo5czXX6wZEDtRL_hpgRzj9Cvx7iHfu87u_j4bgo6VJxbrQkqn4KEEQLUsaY52GGosWKK_r4d-J2RjE3_Mt1QvbILAFL7Jgn943JXZnyG5tj2FhpGqFF5YLtVAiNWZNquDbbeSWcV9E=&xkcb=SoAq-_M3cdKZfw2JbZ0LbzkdCdPP&p=0&fvj=0&vjs=3,Experience with SAP and Excel would be of a distinct advantage for this role.,Supply Chain Planner - Graduate Entry,Prudhoe,30+ days ago,Full-time
Solihull School,https://uk.indeed.com/pagead/clk?mo=r&ad=-6NYlbfkN0DrqGSh15-MgwStAdBykybz-ycweDATqeOCfErLxwKWDGiyntizD-r2g-9Lf7rYEbFOxzYKG5YFUyP_B-4xFz91XZaCJEQnu0S1O3Q-8lY-OjMip3HWCgSV30hyEsyuMEE8RqXw3g-HMbCRGfEsd36FO2kcV2FBlkshYJp9vhYwUmCzzvtda-HKps8qzWi7hEbbTBRYc-3G92ccFVGcrixmP_m7O3V78fEfNWies3c8F2PY0HgklrvjT5ROXN8lsJnTwH4yi1pq8YHQYSosQyfRAK5xD4aLGYia-YXnh4UZN9jgnNMgBe5yj2BFOolB3iQhMuhfYaObsiZ2ZzdhwLUmfnFhw1x8KOjOlIQJYw7W64qbYxERI6xLKbOd6Vo1WiGqDX0dILyJqzmEIFxrxhEGGfzqsLhoOBVeEumae98u44hHqvNjG1DTurRPRkvq5DBM3pxIr_3Np-aWKDiVHjdJBwgm47LaT6gy4NKzNJOmkIplq8SfVu_XZiwXvbRYp-QeCcZRurUNDmmDzEiNLPXuJOGPaL3aiYJX0_-SCqkSwWFGgseRfK04&xkcb=SoAe-_M3cdKZf-wiAp0LbzkdCdPP&p=0&fvj=1&vjs=3,"Looking to continue their form into the new office, g2 Birmingham are looking for entry-level recruitment consultants to expand the specialist team.",Recruitment Consultant - Entry Level Graduate Programme,Birmingham B1,Active 2 days ago,"£19,000 - £45,000 a year"
Global Twenty4,https://uk.indeed.com/pagead/clk?mo=r&ad=-6NYlbfkN0CA88fQEFm6H7kr2bLwILdw6DfDfsOUVNn63MwkaPyDSTK9ru73OOgXmamECp_NfN5hB-D8AvZTkRIwnigW_fIB-3Thn2Q6JyPNZhauQ0v7k4ysPQAjmYgbLAaD8tkYzTrEoEmFsJusbo3uydd6aly0OgOuu77kyCy1-6ov8mN2my2NcnsBhLICvkRsOuWwfu69MH6_A4Nnlqa1zzptLuNuvXeSyTNcgDgPHXtYF6h6biNEhk8JAVjSxFRezj7APV6-xzyP1oJwRFaebwEJ0Yur3pnH9sWE57pb5OYalg-Jch17QW_y5oGslofrOfHqtl4dJ3zT1vFvM6yF2C98AmNsQ60TvamJnGXJTbD6adg8fgaNqBl-jQkdYeRvMzGpVhT1LeoWol4KSwsG2eEc-x_y52FQrROlPxaWqMGIwqw1M6uH8p58YuehzyGE4UchV9KXWnHGFnqAtQLtMxn-KXGhxm6FMb9bJCojQosvEfw3X316hr7no92ijNv0Pbe1orU=&xkcb=SoAk-_M3cdKZfVgNfj0KbzkdCdPP&p=0&fvj=1&vjs=3,Ensure high levels of customer satisfaction through excellent sales and customer service.,Graduate Marketing Assistant,London,1 day ago,"£24,000 - £26,000 a year"
Precision Resource Group,https://uk.indeed.com/pagead/clk?mo=r&ad=-6NYlbfkN0DCc19WU1n5HOLVIY3e_MSUysTEYEvyhq5nw6Qv4vUuTZF-OA5FEIdT7DT8a_2BQkiRYr61uBN11mi9facFSEVw_tRpPHl8rprQE3H0X-xAqfyAKOa43qtqD3IjTngOnt_Gy0vGDkCzScpjqrzd3nWlnoahTy-KtGEsB9ny83BzSVWYlvUmHvn2KzaiE6IrnXfIc8PuGIGIYSMXuFAzoX-j2nhcjzKicwK-PjHJZkUhQGGX3HCHaZBdr8jtQ7wJ1nNNaCI854bHrINMxTCn44Z5fJiC9hF8d2KmCGFeLdqAb-HFCcVWB0UP7xwlvn5q8Ci9J32jcyJBdPzWSJjdNORRrSr0hfAsX_h94uLmQxIwwsWaASaZODuHz_Z11bYBvnpq7IfbBdcQ4CBocjACdSkF96MKoV33rlBwU0D_UMQ_D80OBOI_CwA_4izjHTthBby_ivGjSzqcvnFsR7I7yh_8jHZqRXRxKcDfvBRtzcMXlSPc1nUe6o_Sp4caxdGr151HvXK-rblB0dtwlIlo-VSGwJkt_n_iX5kCvnvkfPioNA==&xkcb=SoBi-_M3cdKZfG2xHB0LbzkdCdPP&p=0&fvj=1&vjs=3,As a,Operations Graduate Programme,Bath,2 days ago,"£26,000 - £28,500 a year"
Where Now Consulting Ltd,https://uk.indeed.com/pagead/clk?mo=r&ad=-6NYlbfkN0D7FDTk9ESfkkGCxcJzdJjQ4h9zcZk8Z6y8zmxkz7FTd6p7R6os1Oy_khRd8zSTHZzbBT-HIw7ImmXKTKgcyXomHheBPbxj331qlIBg3Mo4vgoltJOQn3lU4Aw2ZWn5YGRsQUC_g_yt_A35Iou1Gz8gu2w_sZoJWh08fwVK38h3cdzTVVT1qojGEUAOhHANo4usI1MnES4igZaA-bMf_fvZ2-yrBZ0K3TDXf6yFep4ftg88YAKlNaJoCZyh5G76l1ogS4p3P2lRQijyvuNu3Hi-Cq7ATkHNx8zyHlLJ7o5NFWuK2ba9u895bqRTLiGiyQxnwJM39LeclD7aIVGfoZIoU5sfeyqfQ_a9Pjd36r_jrMscZcplQIGr5RUvH35z4EkmFkeO3pQUqV9kDVh_4yNY8OmJrrCYhhYSGKlivW58j9zQFNufq4R1f-2C1je9VMuk9s8WPRGcjWS7SRnwPjQV3K5zEJeIDVtUTK19hRNdtw==&xkcb=SoDI-_M3cdKYnNWQyJ0LbzkdCdPP&p=0&fvj=1&vjs=3,Cost benefit analysis and costs control.,Graduate Programme,Glasgow,Active 2 days ago,"From £26,000 a year"
Mojo,https://uk.indeed.com/pagead/clk?mo=r&ad=-6NYlbfkN0BBzpTrUEEbl2eT-1NJf7U4BOvM9TidAaIbzc_6DMC19Kry1E9SgBMrUlysNodwdREA5jU6favI1CO6MgpZZba8JNGccsHKM3dpgv62yP2EOvV9TmU_QXfqiUwsWzwuXA_4FV5k8TzTUxlfSVomhDFygxM4hhtCjBwGKqPmavXTzeWKRZSe3NOPEO50vatOZJsJm5onjFvArPocyZkDlzuSzhvA0gTgmUiflNBulqBDcVCmIL2xQhwLSO16yrdHG6SJf4hopWypwqj90iGbldJh8hmJ5UqHvHkyfmQnI0lkNmxHiQS8T7EMiCqrbRf6MSot-2PTxpPxHxIM5en2peTtRw3bevf0B6ogeNk10jgl1VjzFyJUsuteJLQiWaUrex8GCUJU7cz4oNdGTMTWXvA8nraEJq3M-KIhHTk-cgEw198J_vIv_4L6mNSqUYbe3mffNkwFjOYNdEcLOLinrVU5CwTRoXmGluKWxiYN11suHw==&xkcb=SoCA-_M3cdKYsvxgUZ0LbzkdCdPP&p=0&fvj=1&vjs=3,"We are looking for ambitious, motivated and enthusiastic university",Business Graduate Scheme,Manchester,2 days ago,"£22,000 - £24,000 a year"
McGrady Clarke,https://uk.indeed.com/rc/clk?jk=06d058a5078845f0&fccid=0bc887666004e530&vjs=3,Able to work from Newcastle upon Tyne office at least 2-3 days per week (laptop will be given).,Graduate Opportunities,Remote in Newcastle upon Tyne,3 days ago,"£20,500 a year"
proSapient,https://uk.indeed.com/company/Robinhood1/jobs/Graduate-Associate-20cf27e9b3054e45?fccid=9065125d364c7dcf&vjs=3,"You have an interest or background in research, economics, business or financial markets.",Graduate Associate (August 1st Start),Hybrid remote in London WC1X,3 days ago,"From £26,000 a year"
Sure Steps Derby Lane Day Nursery,https://uk.indeed.com/pagead/clk?mo=r&ad=-6NYlbfkN0CC9aKf0JF68GV0FtW1XiZlpvRI8J6f7KVhSLfxLbNGhrFZM1H8Ogj1zVsguGPhJlItum0fMSgKfVcPvwAemMug0DIRQ_88MrLRW2CQW7T7AIutzdkOHvslRqbBxBhUohHhzOTBtjgxvAYyBnYu9bU2lqoQ5UhLFo4HZkYgsaJbyBr4ZXI8WkCuVbDDC8CzZhOt2Yv1pD71VXPxtrwGp6p9O6PSAUWLn5-xVvhfiWSUc6nhrK0h-V3vpJl011x2Zt19ENvDzwhHQzc7HgkNm7d7m8G3gow2w6GupwpJ8rZ1y_9_Xi_DSEyx3WisiORNPVwyLtIP3Di-z0ZCedDY2BuBqsSoztu0M457BL5DcD8Huqv2kNtsFUnfyJbW9jHEwLJiKj4_xAYetciHch9qTj8UsqymXSbkfy9JBwYXZ4MRTkF2VSwOCr-FNZ8j_sZzvgZzugSAl7KK7VQdjMNLfo4cvJBWvGFEZibf4KJ5qi5xBeEiNz9sUc23w58TVSu0F8U=&xkcb=SoBS-_M3cdKYSBxgUZ0LbzkdCdPP&p=0&fvj=1&vjs=3,"Pro Media Liverpool manages the sales and marketing solutions for a huge portfolio of Nationally recognised clients, including those within telecoms, broadband…",Junior Sales and Marketing Trainee,Liverpool L2,Active 1 day ago,"Up to £30,000 a year"
Islington Schools HR Services,https://uk.indeed.com/rc/clk?jk=a09cd4d1e43e2986&fccid=69574e2131f91e3a&vjs=3,If you have the strong,Audience Data Analyst,Boston Spa,7 days ago,"£29,000 a year"
Align Property Partners,https://uk.indeed.com/rc/clk?jk=514131dbfe3b00fb&fccid=960dd873e1354842&vjs=3,Every member of the team at Gleeson contributes to the vision of; Building Homes.,Commercial Graduate,Gateshead NE11,7 days ago,"£24,000 - £28,000 a year"
Intrum AB,https://uk.indeed.com/rc/clk?jk=d333335c5b772172&fccid=5ec7e89341c7fbec&vjs=3,"Contacting customers via the dialler system in order to reach an understanding of the customers’ financial circumstances and where appropriate, setting an…",Customer Service Representative,Remote in Reigate,1 day ago,"£24,000 a year"
Intrum AB,https://uk.indeed.com/rc/clk?jk=d333335c5b772172&fccid=5ec7e89341c7fbec&vjs=3,"Contacting customers via the dialler system in order to reach an understanding of the customers’ financial circumstances and where appropriate, setting an…",Customer Service Representative,Remote in Reigate,1 day ago,"£24,000 a year"
DRA PAT Testing Limited,https://uk.indeed.com/rc/clk?jk=b80c96ea7695aac2&fccid=43cc43f2e0dbc56c&vjs=3,FNZ provides software and consultancy services to the financial services and wealth management industry.,Graduate / Trainee Developer,Newcastle upon Tyne,30+ days ago,"£22,549 a year"
Havas Group,https://uk.indeed.com/rc/clk?jk=f37e65744fdbbf26&fccid=2dd390c3a48a7ed0&vjs=3,Service Line: Tech Digital Lighthouse.,Manager- Data and Analytics,Birmingham,30+ days ago,"£58,000 - £68,000 a year"
27 Talent,https://uk.indeed.com/company/Monarch-Partnership/jobs/Graduate-Trainee-cafce167c9fae95c?fccid=c39a2ee7ae55a319&vjs=3,As a,Graduate Trainee,Wallington SM6,Active 2 days ago,"£20,000 - £22,000 a year"
27 Talent,https://uk.indeed.com/company/Monarch-Partnership/jobs/Graduate-Trainee-cafce167c9fae95c?fccid=c39a2ee7ae55a319&vjs=3,As a,Graduate Trainee,Wallington SM6,Active 2 days ago,"£20,000 - £22,000 a year"
Moffatt and Nichol,https://uk.indeed.com/rc/clk?jk=d26cffd28b4ea451&fccid=a4fddab9a4774361&vjs=3,A Bachelor's degree in,Data Scientist - Infrastructure Engineering - Entry Level,London EC3M,Today,"£22,549 - £24,882 a year"
Tritility Limited,https://uk.indeed.com/rc/clk?jk=1ae357e21db344cb&fccid=848f060296f23fff&vjs=3,This,Graduate UX Researcher,Hybrid remote in Newcastle upon Tyne,24 days ago,"£20,000 - £23,000 a year"
Adams & Moore,https://uk.indeed.com/rc/clk?jk=fe5c9cf33a71a1ce&fccid=7fd19b83953df4b1&vjs=3,We are looking for skilled,Graduate Analyst,Dartford,30+ days ago,"£37,000 a year"
Adams & Moore,https://uk.indeed.com/rc/clk?jk=fe5c9cf33a71a1ce&fccid=7fd19b83953df4b1&vjs=3,We are looking for skilled,Graduate Analyst,Dartford,30+ days ago,"£37,000 a year"
Storm Ideas,https://uk.indeed.com/rc/clk?jk=900d08567cf82984&fccid=fc0eeff012676923&vjs=3,Research the latest,Data Scientist,London,9 days ago,"£22,000 a year"
BMC Recruitment Group,https://uk.indeed.com/company/BMC-Recruitment-Group/jobs/Food-Science-Graduate-7f9cb297c8b2c6ab?fccid=eabdaf6d0e200aa8&vjs=3,Junior Food Science quality role – 12 months fixed term*.,Food Science Graduate,Newcastle upon Tyne,30+ days ago,"£18,000 - £22,000 a year"
develop.,https://uk.indeed.com/rc/clk?jk=a0473698876fb8e0&fccid=18d0aa239188acab&vjs=3,Develop Yourself hour - take an hour a week to learn how to code with our amazing training programme.,Graduate Recruitment Consultant,Hybrid remote in London,3 days ago,"£45,000 a year"
develop.,https://uk.indeed.com/rc/clk?jk=a0473698876fb8e0&fccid=18d0aa239188acab&vjs=3,Develop Yourself hour - take an hour a week to learn how to code with our amazing training programme.,Graduate Recruitment Consultant,Hybrid remote in London,3 days ago,"£45,000 a year"
Link Humans,https://uk.indeed.com/rc/clk?jk=08422a607428e92d&fccid=537b899e30af3338&vjs=3,An interest in,"Trainee Officer, Data Management",Saint Helier JE2,Today,"£24,938 - £26,385 a year"
Celsius Graduate Recruitment,https://uk.indeed.com/rc/clk?jk=e0623c544a11a8d6&fccid=b5859a562bd5d66f&vjs=3,Full support and structures are in place combined with a comprehensive and accredited 12 month training programme developed specifically for graduates.,Graduate Sales Consultant,Durham,30+ days ago,"£35,000 - £40,000 a year"
Knit,https://uk.indeed.com/company/KNIT/jobs/Graduate-Sdr-04d1fad4baad02a4?fccid=e697ce23196b2eac&vjs=3,Competitive salary packages and flexible working.,Graduate SDR / BDR - Coaching + Placement,London,Today,"From £30,000 a year"
Parkwood Hall Co-operative Academy,https://uk.indeed.com/company/Parkwood-Hall-Co--operative-Academy/jobs/Exam-Data-Officer-2808ef01ce795e93?fccid=56e8a9f8f4413310&vjs=3,To manage the administration and processing of all pupil,Exams & Data Officer,Swanley BR8,Today,"£24,301 - £25,753 a year"
Wilton Gilbert Limited,https://uk.indeed.com/company/Wilton-Gilbert-Limited/jobs/Graduate-Recruitment-Consultant-3c69f5aa1b7c864d?fccid=757f5732db1160a7&vjs=3,You'll be commercially astute and have the drive and resilience to be successful in the sector.,Graduate Recruitment Consultant - Renewables,Newcastle upon Tyne NE4,14 days ago,"£20,000 - £22,000 a year"
Hire STEM Women,https://uk.indeed.com/company/EY/jobs/Assurance-Graduate-Programme-838ff82dc3cd1a8b?fccid=1544766d4c2915b0&vjs=3,"Lead Chief Financial Officers in using technology to drive change towards digital finance, sustainable finance, and treasury transformation.",Assurance Graduate Programmes,London,Hiring ongoing,"£20,000 - £30,000 a year"
YPrime,https://uk.indeed.com/rc/clk?jk=69b3f5dab8346342&fccid=ad8e2df6e27bfb16&vjs=3,You’ll maintain a fastidious attention to detail while being aware of any downstream implications of,Data Management Analyst,London,1 day ago,"£20,000 - £40,000 a year"
Knit,https://uk.indeed.com/company/KNIT/jobs/Graduate-Sdr-04d1fad4baad02a4?fccid=e697ce23196b2eac&vjs=3,Competitive salary packages and flexible working.,Graduate SDR / BDR - Coaching + Placement,London,Today,"From £30,000 a year"
Baltic Recruitment Services,https://uk.indeed.com/rc/clk?jk=ba2dc55083899449&fccid=b68233e43806d9c2&vjs=3,Recently industry placement experience or a recent graduate.,NPD Technologist,Gateshead,Today,"£24,000 - £30,000 a year"
LOFT Interiors,https://uk.indeed.com/company/Loft-Interiors/jobs/Business-Development-Executive-1e6772d54878ba55?fccid=176bb96d151e5ec0&vjs=3,"The main focus of this role is to develop relations with, introduce new business from, and maintain continued relationships with private residential…",Business Development Executive - Graduate Opportunity,London W7,Active 3 days ago,"£23,000 - £26,000 a year"
The Rhodes Trust,https://uk.indeed.com/rc/clk?jk=c1f88a94113cccc5&fccid=e15d9e27876d9dc3&vjs=3,No,Data Centre Technician – Returners Programme,Slough,30+ days ago,"£45,000 - £50,000 a year"
Hire STEM Women,https://uk.indeed.com/company/EY/jobs/Assurance-Graduate-Programme-838ff82dc3cd1a8b?fccid=1544766d4c2915b0&vjs=3,"Lead Chief Financial Officers in using technology to drive change towards digital finance, sustainable finance, and treasury transformation.",Assurance Graduate Programmes,London,Hiring ongoing,"£20,000 - £30,000 a year"
BMC Recruitment Group,https://uk.indeed.com/company/BMC-Recruitment-Group/jobs/Graduate-Digital-Marketing-289cea7cc264d8e7?fccid=eabdaf6d0e200aa8&vjs=3,"Creating a strong pipeline of lucrative new business, independently identifying potential new clients, and proactively reaching out to introduce yourself and…",Graduate Digital Marketing,Gateshead,30+ days ago,"£20,000 - £24,000 a year"
Canopy Growth Corporation,https://uk.indeed.com/rc/clk?jk=a1b678e5057b5fec&fccid=fd8cda73a7fe0af3&vjs=3,A competitive,Graduate Production Assistant,Hybrid remote in London W1D,6 days ago,"£30,000 a year"
Northern Care Alliance NHS Foundation Trust,https://uk.indeed.com/rc/clk?jk=b1ad6f7b69bc6bfa&fccid=0a4e6db29e8be4d1&vjs=3,Exploratory,Associate Data Scientist,Crewe CW1,10 days ago,"£43,376 - £50,519 a year"
LOFT Interiors,https://uk.indeed.com/company/Loft-Interiors/jobs/Business-Development-Executive-1e6772d54878ba55?fccid=176bb96d151e5ec0&vjs=3,"The main focus of this role is to develop relations with, introduce new business from, and maintain continued relationships with private residential…",Business Development Executive - Graduate Opportunity,London W7,Active 3 days ago,"£23,000 - £26,000 a year"
Ezoic,https://uk.indeed.com/rc/clk?jk=e5741e8037789406&fccid=d08549dd9ca5f407&vjs=3,"No experience is necessary, as full training will be provided, followed by a paid placement and then long term work supporting students in a local SEND school.",Graduate Trainee Teaching Assistant,Gateshead,7 days ago,£10 - £13 an hour
Binance,https://uk.indeed.com/rc/clk?jk=2c49297e06f2e2d1&fccid=ac2ee5578fa99fc9&vjs=3,Part-time applicants will be considered if they are able to commit at least 3 days per week.,PR Intern,London,30 days ago,"From £50,000 a year"
Skuuudle,https://uk.indeed.com/rc/clk?jk=132c247dd527059c&fccid=13df56734086382c&vjs=3,Previous experience working with large,Data Analyst,Remote in Manchester M2,30+ days ago,"£25,000 - £30,000 a year"
Canopy Growth Corporation,https://uk.indeed.com/rc/clk?jk=a1b678e5057b5fec&fccid=fd8cda73a7fe0af3&vjs=3,A competitive,Graduate Production Assistant,Hybrid remote in London W1D,6 days ago,"£30,000 a year"
Novum Personnel,https://uk.indeed.com/rc/clk?jk=68fd937ef1b58eb9&fccid=a558be8e765d7368&vjs=3,Psychology,Psychology graduate LSA South Tyneside,Newcastle upon Tyne,30+ days ago,"£21,000 a year"
Ameresco,https://uk.indeed.com/rc/clk?jk=5fbfff65af0c0a31&fccid=a1837dda4b6d64d4&vjs=3,"Graduate Engineers will initially join either the Development or Design & Consultancy teams, supported by your development plan and coaching from other staff,…",Graduate Engineer,London,9 days ago,"£23,000 a year"
Binance,https://uk.indeed.com/rc/clk?jk=2c49297e06f2e2d1&fccid=ac2ee5578fa99fc9&vjs=3,Part-time applicants will be considered if they are able to commit at least 3 days per week.,PR Intern,London,30 days ago,"From £50,000 a year"
Mojo,https://uk.indeed.com/company/mojo/jobs/Graduate-Data-Analyst-854732c70943f17f?fccid=c3dd6cb067e6c5b1&vjs=3,Generating reports for analysed,Graduate Data Analyst (Mathematics or similar),Portsmouth,Active 2 days ago,"Up to £25,000 a year"
BVS Vets,https://uk.indeed.com/rc/clk?jk=09aa419bbac25437&fccid=198b7374e1f8a26f&vjs=3,"You’ll often need to explain complex technical information during client meetings and in written reports, so we’re looking for",Personal Tax Assistant School Leaver (ATT/CTA) - Newcastle A...,Newcastle upon Tyne,10 days ago,£70 - £80 a day
cord,https://uk.indeed.com/pagead/clk?mo=r&ad=-6NYlbfkN0DzwreoEVFOkXRcFH1aYDKs9BsTnM4S4dXogYMNQuxRsWEvU3NmJBXmQipkwYVPqOyI1vR7M9foJl_C14vqh_IFAwm6AkHwLk0IUE8BJkgPJu5dO7NPbU3JWmqfuHLLpj5OEl6PjOrL5OhXEGVPY98Cy-Bs0KvIXkyCX-BTZ5CYxs1BxOea3Ci_kgnZPOBG8OsB_OQMPHippgd65H1CK-09iayWQTM6aQw-uf36sJrAMUhE8_UTOtZwM6-k17ZGoNvtZa4gBYdxRP1y2prOF51udCx1AFvcuYicypQZfOEOPuSnMM67nqSdLSnH6jdW6uv7yAz8LFtbi62PaEvtTIygJ8nozzTUlXyMXyeQ01Bc2qm8Wnam3UBskY696gGwTU3QRJiLPxKm5o59qkLKA4LD228UpaimPVExEL-7qAK6oC23AQrnDS_aNXfPxwvSUt89DNnm3uEEYWYeVHNhfaieylZwJrt4HzmE6lDeaef7TuSPk1I3Xq46&xkcb=SoDZ-_M3cdKVkgRSdx0LbzkdCdPP&p=0&fvj=1&vjs=3,"As our new Junior Business Analyst, you will work closely with the Head of Business Management and sales team to enhance core business performance and hit…",Junior Business Analyst,Hybrid remote in London,Active 9 days ago,"£25,000 - £28,000 a year"
Ameresco,https://uk.indeed.com/rc/clk?jk=5fbfff65af0c0a31&fccid=a1837dda4b6d64d4&vjs=3,"Graduate Engineers will initially join either the Development or Design & Consultancy teams, supported by your development plan and coaching from other staff,…",Graduate Engineer,London,9 days ago,"£23,000 a year"
Media Effect,https://uk.indeed.com/company/Media-Effect/jobs/Data-Analyst-95f161fd24d7bdf1?fccid=f85c0a0c54ce0588&vjs=3,Data analyst: 2 years (required).,Data Analyst (Part-time),London W6,2 days ago,"£23,000 - £24,000 a year"
Trusted Reviews Ltd,https://uk.indeed.com/rc/clk?jk=4775f29264f97f7e&fccid=fe8ef253a7528660&vjs=3,28% reduction in carbon emission intensity (tenth year in a row).,Graduate Construction Manager - South,London,30+ days ago,"£28,500 a year"
cord,https://uk.indeed.com/pagead/clk?mo=r&ad=-6NYlbfkN0DzwreoEVFOkXRcFH1aYDKs9BsTnM4S4dXogYMNQuxRsWEvU3NmJBXmQipkwYVPqOyI1vR7M9foJl_C14vqh_IFAwm6AkHwLk0IUE8BJkgPJu5dO7NPbU3JWmqfuHLLpj5OEl6PjOrL5OhXEGVPY98Cy-Bs0KvIXkyCX-BTZ5CYxs1BxOea3Ci_Oo-V6N7GlvOheM1kgcOGythuBdNGbzc6ZrpM5JF_QDugde0xF4UoM_F-eXoYgxYEgRJfqKSvqIQurQn4TFEQtpilNxftREBbmIIxt6GdBadWL6KSB-ReEzOikDOUAVgOiLE_b611OLtcAfMazmR1ZqxZPonP8YhMO9Ngvqnq3sFtfIr3GYwgbCeHk3UdQ4K-gbZSc81GkrwXeRyBfe_a3zTsU1VxHgC7jrUeKTeDTzQz3CToaCQn8BTV2ClflLvI44trughjbvmSGErutZKFZ6VmiJMzqCABrfb7NdTWhgLJu8wZ8JEj_sw_vEHMmF_O&xkcb=SoCj-_M3cdKVHOW9dJ0LbzkdCdPP&p=0&fvj=1&vjs=3,"As our new Junior Business Analyst, you will work closely with the Head of Business Management and sales team to enhance core business performance and hit…",Junior Business Analyst,Hybrid remote in London,Active 9 days ago,"£25,000 - £28,000 a year"
Wave Recruitment,https://uk.indeed.com/rc/clk?jk=9a980ea78bab8678&fccid=057abf3fd357e717&vjs=3,"A bank that knows its customers and clients, champions innovation and thinks digital first, offers trusted money management guidance and support, and provides…",Retail Banking Data & Analytics Analyst - Expert Summer Inte...,London E14,30+ days ago,"£65,000 - £75,000 a year"
Capstone,https://uk.indeed.com/company/CITY-OF-LONDON-POLICE/jobs/Police-Constable-64ad2a901c002dba?fccid=fc5cf85d24ad1b6f&vjs=3,Applications are also invited from candidates who hold a valid Day 1 pass.,Police Constable- Student Officer,London,2 days ago,"From £31,686 a year"
Trusted Reviews Ltd,https://uk.indeed.com/rc/clk?jk=4775f29264f97f7e&fccid=fe8ef253a7528660&vjs=3,28% reduction in carbon emission intensity (tenth year in a row).,Graduate Construction Manager - South,London,30+ days ago,"£28,500 a year"
Oleeo,https://uk.indeed.com/company/WCN/jobs/Tableau-Data-Analytic-Engineer-8a52024bd3c99b77?fccid=742ac0755c33780e&vjs=3,Solving any,Tableau Data Analytics Engineer (Part time - Remote/Hybrid),Coventry CV4,8 days ago,"£20,641 - £29,890 a year"
Lendable,https://uk.indeed.com/rc/clk?jk=2910919824615c7d&fccid=d105d63023c1a0b0&vjs=3,Hours per week: 35 hours per week (Full Time).,Student Records Analyst,Hybrid remote in London,1 day ago,"£26,220 - £36,000 a year"
Capstone,https://uk.indeed.com/company/CITY-OF-LONDON-POLICE/jobs/Police-Constable-64ad2a901c002dba?fccid=fc5cf85d24ad1b6f&vjs=3,Applications are also invited from candidates who hold a valid Day 1 pass.,Police Constable- Student Officer,London,2 days ago,"From £31,686 a year"
MPL Search,https://uk.indeed.com/company/MPL-Search/jobs/Trainee-Graduate-Consultant-Scheme-5acce97dd32739fb?fccid=508141732116db6a&vjs=3,As a,trainee graduate consultant scheme,London,Hiring ongoing,"£28,000 - £50,000 a year"
RELX,https://uk.indeed.com/rc/clk?jk=a71c27b41bb8cdf0&fccid=098f028fec64b983&vjs=3,,Graduate Data Science Programme 2022,Hybrid remote in London,1 day ago,"£17,922 a year"
Lendable,https://uk.indeed.com/rc/clk?jk=2910919824615c7d&fccid=d105d63023c1a0b0&vjs=3,Hours per week: 35 hours per week (Full Time).,Student Records Analyst,Hybrid remote in London,1 day ago,"£26,220 - £36,000 a year"
proSapient,https://uk.indeed.com/company/proSapient/jobs/Graduate-Language-Associate-30d665ff65746f9f?fccid=9d0968b95338e278&vjs=3,"You have an interest or background in research, economics, business or financial markets.",Graduate Language Associate (European Languages) - 2022 Star...,Hybrid remote in London,30+ days ago,"From £31,000 a year"
Dragoonis Technologies,https://uk.indeed.com/rc/clk?jk=53c2464a30eb06df&fccid=64189ab166716f29&vjs=3,"From the equipment that frontline officers require to be able to make decisions on the street, big",Database Administrator,Arnold,30+ days ago,"£38,064 - £41,517 a year"
MPL Search,https://uk.indeed.com/company/MPL-Search/jobs/Trainee-Graduate-Consultant-Scheme-5acce97dd32739fb?fccid=508141732116db6a&vjs=3,As a,trainee graduate consultant scheme,London,Hiring ongoing,"£28,000 - £50,000 a year"
